{
  "contract_version": "1.0",
  "source_truth_id": "ST-SCOPE-001",
  "course_identity": {
    "course_name": "数据库应用基础",
    "major": "软件技术专业",
    "audience": "高职二年级"
  },
  "sources": [
    {
      "source_id": "confirmed-profile",
      "source_type": "confirmed_course_profile",
      "label": "Confirmed course facts",
      "locator": "evidence/confirmed-profile.json",
      "sha256": "491e4e8edb07f60ce33f9efaa5e60818a8d68d7152d29eabd8b727eda4e477c2",
      "provenance": "Synthetic regression fixture"
    },
    {
      "source_id": "frozen-outline",
      "source_type": "whole_course_outline",
      "label": "Frozen whole-course outline",
      "locator": "evidence/whole-course-outline.json",
      "sha256": "1e5374e3b5ccbea5a184036db1695d3766e443e58301221bc637477aab045298",
      "provenance": "Synthetic regression fixture"
    }
  ],
  "created_at": "2026-10-01T10:00:00Z",
  "manifest_fingerprint": "bc111b55def2505e6a61ff6856fcedc5edf3720bc0347540cc7b66a67dfeda8d"
}
