{
  "contract_version": "1.0",
  "source_truth_id": "ST-SCOPE-001",
  "course_identity": {
    "course_name": "机械制图与测绘",
    "major": "机械制造专业",
    "audience": "高职二年级"
  },
  "sources": [
    {
      "source_id": "confirmed-profile",
      "source_type": "confirmed_course_profile",
      "label": "Confirmed course facts",
      "locator": "evidence/confirmed-profile.json",
      "sha256": "de2f60f9a9f5618831f69c8b3ce03651453f9ad66f89f2e0b00d3f9d3493c332",
      "provenance": "Synthetic regression fixture"
    },
    {
      "source_id": "frozen-outline",
      "source_type": "whole_course_outline",
      "label": "Frozen whole-course outline",
      "locator": "evidence/whole-course-outline.json",
      "sha256": "49d7ecff2da41f79813962001fbfe9d9c6b2cf65ca88dc66f934089f1cd1081c",
      "provenance": "Synthetic regression fixture"
    }
  ],
  "created_at": "2026-10-01T10:00:00Z",
  "manifest_fingerprint": "0958e905fd88ee914efc22c4e2936b4c2329121c707a20c510d41c8af4e80d08"
}
